{"$id":"urn:rd22:step11:orientation-unitary-consumer-binding:v001","$schema":"https://json-schema.org/draft/2020-12/schema","additionalProperties":false,"properties":{"carrier":{"type":"object"},"conclusion":{"type":"object"},"derivation_id":{"enum":["D08_ORIENTATION_REVERSAL_COVARIANCE","O02_FULL_SOURCE_RECORD_ORIENTATION_COVARIANCE"]},"expected_conclusion":{"type":"object"},"row_id":{"enum":["C-B-V011-SP1-07","C-B-V011-SP2-05"]},"schema":{"const":"rd22.step11.orientation-unitary-consumer-binding.v001"},"shared_proof":{"type":"object"},"status":{"const":"KERNEL_READY"},"target_opcode":{"const":"KERNEL"}},"required":["schema","row_id","derivation_id","target_opcode","carrier","shared_proof","expected_conclusion","conclusion","status"],"type":"object"}