{"carrier":{"byte_length":3088,"relative_path":"step11_orientation_unitary/generated/7c19430b1346cf6aab1a217f634add352bfc8e55cf3e2f7d87fc2d1f2f9f841f--U_CELL_ORIENTATION_CANONICAL.json","sha256":"7c19430b1346cf6aab1a217f634add352bfc8e55cf3e2f7d87fc2d1f2f9f841f"},"conclusion":{"predicate":"ORIENTATION_REVERSAL_COVARIANCE","result":"h_reversed=U_record h_K U_record^-1"},"derivation_id":"D08_ORIENTATION_REVERSAL_COVARIANCE","expected_conclusion":{"predicate":"ORIENTATION_REVERSAL_COVARIANCE","result":"h_reversed=U_record h_K U_record^-1"},"row_id":"C-B-V011-SP1-07","schema":"rd22.step11.orientation-unitary-consumer-binding.v001","shared_proof":{"byte_length":3518,"relative_path":"step11_orientation_unitary/generated/2a1e0926529903be4b8a2abfbbb69071193547ec43f3bf9e1c863ef31f001be9--P_ORIENTATION_UNITARY_AND_COMPLETE_HK_SQUARE.json","sha256":"2a1e0926529903be4b8a2abfbbb69071193547ec43f3bf9e1c863ef31f001be9"},"status":"KERNEL_READY","target_opcode":"KERNEL"}